{
  "status": "PASS",
  "provider": "cursorcli",
  "started_at": "2026-06-15T09:33:00Z",
  "completed_at": "2026-06-15T09:34:00Z",
  "validation_required": true,
  "files_changed": [
    "automation/provider_task_classifier.py"
  ],
  "error_message": null,
  "decision_artifact_path": "PM_Pack/automation/provider_decisions/DEC-080-0001.json"
}
